id,patient_id,authored,type,text
1000000000,1234567,2021-12-01 09:24:20.000000,Ontslagbericht,Anne de Vries is een 22-jarige vrouw bij wie enige tijd geleden acute myeloïde leukemie was vastgesteld.
1000000001,1234567,2021-12-02 09:25:19.000000,Poliklinische Brief,De patiënte was alleen als kind gevaccineerd.
1000000002,2345678,2021-12-04 09:25:48.000000,Spoedeisende Hulp,"Marie de Jong, een 53-jarige vrouw, bezoekt ons spreekuur vanwege een verhoogde bloeddruk."
1000000003,3456789,2021-12-10 09:26:12.000000,Poliklinische Brief,"Piet Jansen werd behandeld voor diabetes mellitus type 2 met metformine 2 dd 1000 mg, gliclazide 3 dd 80 mg en NPH-insuline 32 eenheden voor de nacht."
1000000004,3456789,2021-12-10 21:26:49.000000,Spoedeisende Hulp,"Een intensivering van de bloedglucoseverlagende behandeling was nodig, tot 4 maal daags insulinetherapie."
